<?xml version="1.0" encoding="UTF-8" ?>

<game xmlns:xsi="http://www.w3.org/2001/XMLSchema-instance" xsi:noNamespaceSchemaLocation="Society.xsd">
    <time-unit>
        seconds
    </time-unit>
    <finite>true</finite>
    <end-time>10000</end-time>
    <cells>
        <cell>
            <symbol>1</symbol>
            <fill>
                <type>COLOR</type>
                <content>red</content>
            </fill>
            <action>Test</action>
        </cell>
    </cells>
    <state>
        <type>RANDOM</type>
        <grid>
            01234324
            12312311
            12312312
        </grid>
        <distribution>
            <weight cell="0">.7</weight>
            <weight cell="1">.3</weight>
        </distribution>
    </state>
</game>