<?xml version="1.0" encoding="UTF-8" ?>

<game xmlns:xsi="http://www.w3.org/2001/XMLSchema-instance" xsi:noNamespaceSchemaLocation="Society.xsd">
    <time-unit>
        seconds
    </time-unit>
    <cells>
        <cell>
            <symbol>X</symbol>
            <fill>
                <type>COLOR</type>
                <content>red</content>
            </fill>
            <action>segregation.Agent</action>
        </cell>
        <cell>
            <symbol>O</symbol>
            <fill>
                <type>COLOR</type>
                <content>blue</content>
            </fill>
            <action>segregation.Agent</action>
        </cell>
    </cells>
    <state>
        <type>RANDOM</type>
        <distribution>
            <weight cell="0">.5</weight>
            <weight cell="X">.3</weight>
            <weight cell="O">.2</weight>
        </distribution>
    </state>
</game>